<?xml version="1.0" encoding="UTF-8"?>
<!ELEMENT QuanLyLop (LopHoc)* >
<!ELEMENT LopHoc (MaLop, TenLop) >
<!ELEMENT MaLop (#PCDATA) >
<!ELEMENT TenLop (#PCDATA) >